{
  "degradation_state": "normal",
  "latency_breakdown": {
    "compile_validate_ms": 4,
    "rerank_prune_ms": 0,
    "retrieval_ms": 0,
    "total_pact_overhead_ms": 4
  },
  "model_call_allowed": true,
  "packet_class": "answer_packet",
  "packet_hash": "99b00c59b6c48caf7d762faf76cb779261b61054bae4e965b975ac4a4b69cdab",
  "packet_id": "pkt_5c890593e9c1c0e8",
  "pruning_mode": "none",
  "receipt_id": "rcpt_c9d30156e36fd002",
  "request_id": "req_8ef0dcf5925fbb9c",
  "retrieval_mode": "lexical_only",
  "safe_failure_invoked": false,
  "schema_version": "1.0.0",
  "serialization_profile": "plain_text_only",
  "source_lineage_digest": {
    "digest": "5811829d23f43af0e9b6dbe0eb3a2e7525e908e70716065b072fdac2985f4fb5",
    "digest_algorithm": "sha256",
    "source_scope": "request"
  },
  "token_counts": {
    "input_tokens": 340,
    "naive_baseline_tokens": 107,
    "reduction_percentage": 0.0
  },
  "trace_id": "trace_3558d79acfc22daa",
  "version_set": {
    "budget_version": "v1_lock",
    "compatibility_posture": "compatible",
    "contract_version": "1.0.0",
    "corpus_version": "starter",
    "runtime_version": "slice_06"
  }
}
